{
  "schema_version": "1.0.0",
  "peep_id": "b7a9e682-d4e8-4a7f-9f0d-2f5d2e8c9a77",
  "person_profile": {
    "schema_version": "1.0.0",
    "person_id": "6e0a94a4-2b2a-4d49-9d8e-3b19a2f2f9c1",
    "name": { "given": "Alex", "family": "Taylor" },
    "communication_preferences": ["spoken", "visual_alarm"],
    "impairments_summary": [{ "category": "mobility", "severity": "moderate", "description": "Manual wheelchair" }]
  },
  "location": {
    "schema_version": "1.0.0",
    "thoroughfare": "12 Market Street",
    "town": "Exampleton",
    "postcode": "EC1A 1AA",
    "country_code": "GB",
    "internal_location": { "building_id": "BLDG-001", "level": "4", "area": "Flat 4B" }
  },
  "evacuation_strategy": "Simultaneous Evacuation",
  "routes": [
    {
      "name": "Primary",
      "path_description": "From Flat 4B to Stair A via corridor; descend to ground and exit to Muster Point A",
      "via_structural_elements": ["Corridor 4E", "Stair A"],
      "assistance": [
        { "type": "evac_chair", "persons_required": 2, "notes": "Trained staff from concierge team" }
      ],
      "equipment": ["Evac Chair EC-01"],
      "refuge": { "location": "Refuge adjacent to Stair A, Level 4", "wait_condition": "If corridor is untenable" }
    },
    {
      "name": "Secondary",
      "path_description": "From Flat 4B to Refuge at Lift 1 lobby",
      "via_structural_elements": ["Corridor 4E", "Lift 1 Lobby"],
      "assistance": [{ "type": "guided_evacuate" }]
    }
  ],
  "communications": {
    "alarm_hearing_ability": "needs_visual",
    "alerting_methods": ["Visual beacons", "Door knocking if needed"]
  },
  "nighttime_considerations": "Ensure vibrating pillow pad linked to detector base station.",
  "training_drills": "Annual drill with evac chair team.",
  "medical_considerations": "Carry asthma inhaler.",
  "evacuation_procedure": [
    { "order": 1, "instruction": "On alarm, check corridor conditions through spyhole." },
    { "order": 2, "instruction": "If clear, move to Stair A with buddy support." },
    { "order": 3, "instruction": "Transfer to evac chair; descend with trained staff." },
    { "order": 4, "instruction": "Proceed to Muster Point A; await roll call." }
  ],
  "references": {
    "pcfra_id": "3a5d1a56-3d8c-4c34-8e68-0d4c2b3b7f01",
    "building_statement_ees_id": "a8fd2c73-2ea4-4aee-b5e1-e7f4d2c879a1"
  },
  "consent": {
    "schema_version": "1.0.0",
    "consent_id": "1a1a1a1a-2222-3333-4444-555555555555",
    "subject_id": "6e0a94a4-2b2a-4d49-9d8e-3b19a2f2f9c1",
    "status": "given",
    "scope": ["PEEP"],
    "method": "digital",
    "actor": { "name": "Alex Taylor", "role": "Resident" },
    "recorded_at": "2025-08-12T09:30:00Z"
  },
  "review": {
    "schema_version": "1.0.0",
    "status": "approved",
    "version": "1.0.0",
    "created_by": "Morgan Smith",
    "created_at": "2025-08-12T09:35:00Z",
    "reviewed_by": "J. Patel",
    "reviewed_at": "2025-08-12T10:00:00Z",
    "next_review_due": "2026-08-12"
  }
}